Usuario,Cuadrilla,Descripcion,Categoria,Subcausa,Modo,Clasificacion,Tipo_Falla,Confianza_%,Prob_FM,Prob_E,Prob_I,X_UTM,Y_UTM,Alimentador,Confianza_Alim_%,Dist_punto_m,Comunas,N°,Fecha_hora
juan,Cuadrilla 1 — Curicó Norte,Caída de árbol sobre red MT/BT,🌿 Árboles / Vegetación,Caída de árbol sobre la red,Guiado,I,Interna,82.8,15.4,1.8,82.8,,,,,,,1,2026-06-14 02:38:05
juan,Cuadrilla 1 — Curicó Norte,Caída de árbol sobre red MT/BT,🌿 Árboles / Vegetación,Caída de árbol sobre la red,Guiado,I,Interna,82.8,15.4,1.8,82.8,311895.562,6147369.879,2.0,100.0,0.0,"Chimbarongo, Teno",2,2026-06-14 02:42:25
juan,Cuadrilla 1 — Curicó Norte,Caída de árbol sobre red MT/BT,🌿 Árboles / Vegetación,Caída de árbol sobre la red,Guiado,I,Interna,82.8,15.4,1.8,82.8,315907.44,6141072.95,2.0,100.0,0.0,"Chimbarongo, Teno",3,2026-06-14 02:55:11
PEPE,Cuadrilla 1 — Curicó Norte,Caída de árbol sobre red MT/BT. caida poste,🌿 Árboles / Vegetación,Caída de árbol sobre la red,Guiado,I,Interna,61.6,36.4,2.0,61.6,312406.85,6146516.46,2.0,100.0,0.0,"Chimbarongo, Teno",4,2026-06-14 02:56:54
juanito,Cuadrilla 1 — Curicó Norte,Sabotaje a instalación eléctrica,🎯 Actos Vandálicos,Sabotaje,Guiado,I,Interna,67.0,15.6,17.4,67.0,,,,,,,5,2026-06-14 03:00:38
